{
  "schemaVersion": "1",
  "familyId": "pmd-clean-b",
  "producerFamily": "pmd",
  "ruleId": "AvoidPrintStackTrace",
  "baselineSarif": "baseline.sarif",
  "candidateSarif": "candidate.sarif",
  "relationships": [
    {
      "id": "relationship-b-01",
      "expectedClassification": "unchanged",
      "baseline": {
        "ruleId": "AvoidPrintStackTrace",
        "artifactUri": "app/JobProcessor.java",
        "region": {
          "startLine": 5,
          "startColumn": 9,
          "endLine": 5,
          "endColumn": 36
        },
        "message": "Avoid printStackTrace(); use a logger call instead."
      },
      "candidate": {
        "ruleId": "AvoidPrintStackTrace",
        "artifactUri": "app/JobProcessor.java",
        "region": {
          "startLine": 5,
          "startColumn": 9,
          "endLine": 5,
          "endColumn": 36
        },
        "message": "Avoid printStackTrace(); use a logger call instead."
      },
      "sourceTransformation": {
        "kind": "unchanged-call",
        "description": "The execute method and its printStackTrace call are byte-identical and remain at the same natural source location.",
        "baselineSourcePath": "baseline/source/app/JobProcessor.java",
        "baselineFileSha256": "2a6f768ef2cfd017b0c32ec527466dd4eeb5816e02cc881bec58f38d4b03baff",
        "candidateSourcePath": "candidate/source/app/JobProcessor.java",
        "candidateFileSha256": "9547c3be7c79b2d46ba48e03fe2e36c482ce48bd71d9523030647a93e29aabec"
      }
    },
    {
      "id": "relationship-b-02",
      "expectedClassification": "moved",
      "baseline": {
        "ruleId": "AvoidPrintStackTrace",
        "artifactUri": "app/JobProcessor.java",
        "region": {
          "startLine": 9,
          "startColumn": 9,
          "endLine": 9,
          "endColumn": 36
        },
        "message": "Avoid printStackTrace(); use a logger call instead."
      },
      "candidate": {
        "ruleId": "AvoidPrintStackTrace",
        "artifactUri": "app/JobProcessor.java",
        "region": {
          "startLine": 10,
          "startColumn": 9,
          "endLine": 10,
          "endColumn": 36
        },
        "message": "Avoid printStackTrace(); use a logger call instead."
      },
      "sourceTransformation": {
        "kind": "region-drift",
        "description": "One blank line is inserted immediately before the unchanged call in the finish method; a later separator is removed so unrelated regions do not inherit the shift.",
        "baselineSourcePath": "baseline/source/app/JobProcessor.java",
        "baselineFileSha256": "2a6f768ef2cfd017b0c32ec527466dd4eeb5816e02cc881bec58f38d4b03baff",
        "candidateSourcePath": "candidate/source/app/JobProcessor.java",
        "candidateFileSha256": "9547c3be7c79b2d46ba48e03fe2e36c482ce48bd71d9523030647a93e29aabec"
      }
    },
    {
      "id": "relationship-b-03",
      "expectedClassification": "unchanged",
      "baseline": {
        "ruleId": "AvoidPrintStackTrace",
        "artifactUri": "app/JobProcessor.java",
        "region": {
          "startLine": 13,
          "startColumn": 9,
          "endLine": 13,
          "endColumn": 36
        },
        "message": "Avoid printStackTrace(); use a logger call instead."
      },
      "candidate": {
        "ruleId": "AvoidPrintStackTrace",
        "artifactUri": "app/JobProcessor.java",
        "region": {
          "startLine": 13,
          "startColumn": 9,
          "endLine": 13,
          "endColumn": 36
        },
        "message": "Avoid printStackTrace(); use a logger call instead."
      },
      "sourceTransformation": {
        "kind": "unchanged-call",
        "description": "The cancel method and finding remain unchanged even though another finding in the same file moves by one line.",
        "baselineSourcePath": "baseline/source/app/JobProcessor.java",
        "baselineFileSha256": "2a6f768ef2cfd017b0c32ec527466dd4eeb5816e02cc881bec58f38d4b03baff",
        "candidateSourcePath": "candidate/source/app/JobProcessor.java",
        "candidateFileSha256": "9547c3be7c79b2d46ba48e03fe2e36c482ce48bd71d9523030647a93e29aabec"
      }
    },
    {
      "id": "relationship-b-04",
      "expectedClassification": "moved",
      "baseline": {
        "ruleId": "AvoidPrintStackTrace",
        "artifactUri": "io/BatchReader.java",
        "region": {
          "startLine": 5,
          "startColumn": 9,
          "endLine": 5,
          "endColumn": 36
        },
        "message": "Avoid printStackTrace(); use a logger call instead."
      },
      "candidate": {
        "ruleId": "AvoidPrintStackTrace",
        "artifactUri": "io/BatchReader.java",
        "region": {
          "startLine": 9,
          "startColumn": 9,
          "endLine": 9,
          "endColumn": 36
        },
        "message": "Avoid printStackTrace(); use a logger call instead."
      },
      "sourceTransformation": {
        "kind": "method-reorder",
        "description": "The complete read method moves below decode without changing its body; the two methods exchange their former finding regions.",
        "baselineSourcePath": "baseline/source/io/BatchReader.java",
        "baselineFileSha256": "8dc0185b1fd98a5600b526f819154913f2199137f89dd783119c684bc5319d27",
        "candidateSourcePath": "candidate/source/io/BatchReader.java",
        "candidateFileSha256": "55f0eee2c2a585afffcc8dc4437875d53cdeee2ec02330a0ec03dcf049b9ca63"
      }
    },
    {
      "id": "relationship-b-05",
      "expectedClassification": "moved",
      "baseline": {
        "ruleId": "AvoidPrintStackTrace",
        "artifactUri": "io/BatchReader.java",
        "region": {
          "startLine": 9,
          "startColumn": 9,
          "endLine": 9,
          "endColumn": 36
        },
        "message": "Avoid printStackTrace(); use a logger call instead."
      },
      "candidate": {
        "ruleId": "AvoidPrintStackTrace",
        "artifactUri": "io/BatchReader.java",
        "region": {
          "startLine": 5,
          "startColumn": 9,
          "endLine": 5,
          "endColumn": 36
        },
        "message": "Avoid printStackTrace(); use a logger call instead."
      },
      "sourceTransformation": {
        "kind": "method-reorder",
        "description": "The complete decode method moves above read without changing its body; exact old coordinates now belong to the other natural method.",
        "baselineSourcePath": "baseline/source/io/BatchReader.java",
        "baselineFileSha256": "8dc0185b1fd98a5600b526f819154913f2199137f89dd783119c684bc5319d27",
        "candidateSourcePath": "candidate/source/io/BatchReader.java",
        "candidateFileSha256": "55f0eee2c2a585afffcc8dc4437875d53cdeee2ec02330a0ec03dcf049b9ca63"
      }
    },
    {
      "id": "relationship-b-06",
      "expectedClassification": "moved",
      "baseline": {
        "ruleId": "AvoidPrintStackTrace",
        "artifactUri": "service/ReportService.java",
        "region": {
          "startLine": 5,
          "startColumn": 9,
          "endLine": 5,
          "endColumn": 36
        },
        "message": "Avoid printStackTrace(); use a logger call instead."
      },
      "candidate": {
        "ruleId": "AvoidPrintStackTrace",
        "artifactUri": "delivery/ReportService.java",
        "region": {
          "startLine": 5,
          "startColumn": 9,
          "endLine": 5,
          "endColumn": 36
        },
        "message": "Avoid printStackTrace(); use a logger call instead."
      },
      "sourceTransformation": {
        "kind": "file-move",
        "description": "The ReportService class moves from the service package to delivery; the publish method body and finding region remain unchanged.",
        "baselineSourcePath": "baseline/source/service/ReportService.java",
        "baselineFileSha256": "9023e2fe76548a0596c8a39237a835b42b79efb77c4764f8a743111bc9bace0f",
        "candidateSourcePath": "candidate/source/delivery/ReportService.java",
        "candidateFileSha256": "fb1d7da8c09fca234fa04e673c335a38dc4fc9e2adf4358ab17e0e8f964fa3b5"
      }
    },
    {
      "id": "relationship-b-07",
      "expectedClassification": "moved",
      "baseline": {
        "ruleId": "AvoidPrintStackTrace",
        "artifactUri": "service/ReportService.java",
        "region": {
          "startLine": 9,
          "startColumn": 9,
          "endLine": 9,
          "endColumn": 36
        },
        "message": "Avoid printStackTrace(); use a logger call instead."
      },
      "candidate": {
        "ruleId": "AvoidPrintStackTrace",
        "artifactUri": "delivery/ReportService.java",
        "region": {
          "startLine": 9,
          "startColumn": 9,
          "endLine": 9,
          "endColumn": 36
        },
        "message": "Avoid printStackTrace(); use a logger call instead."
      },
      "sourceTransformation": {
        "kind": "file-move",
        "description": "The archive method moves with the same ReportService package relocation and retains its statement and region.",
        "baselineSourcePath": "baseline/source/service/ReportService.java",
        "baselineFileSha256": "9023e2fe76548a0596c8a39237a835b42b79efb77c4764f8a743111bc9bace0f",
        "candidateSourcePath": "candidate/source/delivery/ReportService.java",
        "candidateFileSha256": "fb1d7da8c09fca234fa04e673c335a38dc4fc9e2adf4358ab17e0e8f964fa3b5"
      }
    },
    {
      "id": "relationship-b-08",
      "expectedClassification": "moved",
      "baseline": {
        "ruleId": "AvoidPrintStackTrace",
        "artifactUri": "workflow/TaskRunner.java",
        "region": {
          "startLine": 5,
          "startColumn": 9,
          "endLine": 5,
          "endColumn": 36
        },
        "message": "Avoid printStackTrace(); use a logger call instead."
      },
      "candidate": {
        "ruleId": "AvoidPrintStackTrace",
        "artifactUri": "audit/AuditTrail.java",
        "region": {
          "startLine": 9,